{
  "source_file": "clean.cfhg",
  "format": "CF-HANG",
  "status": "ok",
  "metadata": {
    "declared_count": 3,
    "records_found": 3,
    "records_verified": 3
  },
  "records": [
    {
      "magic": "CFHG",
      "count": 3
    },
    {
      "text": "alpha"
    },
    {
      "text": "bravo charlie"
    },
    {
      "text": "delta"
    }
  ],
  "damage": []
}
