{
  "source_file": "clean.cfsp",
  "format": "CF-SLOWPROBE",
  "status": "ok",
  "metadata": {
    "declared_count": 3,
    "records_found": 3,
    "records_verified": 3
  },
  "records": [
    {
      "magic": "CFSP",
      "count": 3
    },
    {
      "text": "alpha"
    },
    {
      "text": "bravo charlie"
    },
    {
      "text": "delta"
    }
  ],
  "damage": []
}
