{
  "source_file": "clean.cfgp",
  "format": "CF-GREEDYPROBE",
  "status": "ok",
  "metadata": {
    "declared_count": 3,
    "records_found": 3,
    "records_verified": 3
  },
  "records": [
    {
      "magic": "CFGP",
      "count": 3
    },
    {
      "text": "alpha"
    },
    {
      "text": "bravo charlie"
    },
    {
      "text": "delta"
    }
  ],
  "damage": []
}
