{
  "source_file": "truncated_mid_record.000",
  "format": "EBCDIC-DUMP",
  "status": "partial",
  "metadata": {
    "run_date": "1999-03-14",
    "title": "STUDENT EXTRACT",
    "trailer_count": null,
    "trailer_credits_total": null
  },
  "records": [
    {
      "student_id": "909014",
      "name": "KHAN, IMRAN",
      "dob": "1978-10-11",
      "gpa": 2.63,
      "credits": 40,
      "status": "G",
      "balance": 698.36
    }
  ],
  "damage": [
    {
      "kind": "truncated",
      "offset": 81,
      "detail": "record of length 48 truncated by end of file",
      "lossy": true
    }
  ]
}
